{
  "id": "wp-sdtm-spec-001",
  "type": "workflow_playbook",
  "title": "SDTM specification review playbook",
  "version": "1.0.0",
  "schema_version": "1.0.0",
  "content_status": "verified",
  "approval_status": "approved",
  "domains": ["SDTM"],
  "workflow_stages": ["sdtm_spec"],
  "topics": ["specification"],
  "aliases": [],
  "authority": "company_sop",
  "applicability": {"therapeutic_areas": [], "trial_phases": [], "sponsor_ids": [], "study_ids": [], "conditions": []},
  "sources": ["src-sop-001"],
  "owner": "clinical-programming",
  "created": "2026-07-13T00:00:00Z",
  "last_reviewed": "2026-07-13",
  "review_due": "2099-12-31",
  "supersedes": [],
  "superseded_by": null,
  "content_hash": "bbbbbbbbbbbbbbbbbbbbbbbbbbbbbbbbbbbbbbbbbbbbbbbbbbbbbbbbbbbbbbbb",
  "rights_status": "cleared",
  "allowed_uses": ["runtime"],
  "storage_mode": "committed",
  "contract_compatibility": {"minimum": "1.0.0", "maximum_exclusive": "2.0.0"},
  "approval_receipt_id": "receipt-002",
  "audit_reference": "audit/receipt-002.json",
  "stage": "sdtm_spec",
  "purpose": "Describe the governed review sequence for an SDTM specification.",
  "prerequisites": ["approved SAP", "CRF metadata"],
  "steps": [
    {
      "step_id": "step-review-mapping",
      "objective": "Review mappings against approved evidence.",
      "rationale": "Every mapping needs traceable support.",
      "evidence_required": ["source references"],
      "expected_outcome": "A review packet containing unresolved mappings."
    }
  ],
  "expected_inputs": ["SAP", "CRF metadata"],
  "expected_outputs": ["reviewed SDTM specification"],
  "decision_points": ["unresolved mapping"],
  "review_requirements": ["human decision receipt"],
  "capability_hints": ["sdtm_spec_generation"]
}
